<?xml version="1.0"?>
<!DOCTYPE HPCToolkitExperiment [
<!-- ******************************************************************** -->
<!-- HPCToolkit Experiment DTD						  -->
<!-- Version 2.0							  -->
<!-- ******************************************************************** -->
<!ELEMENT HPCToolkitExperiment (Header, (SecCallPathProfile|SecFlatProfile)*)>
<!ATTLIST HPCToolkitExperiment
	  version CDATA #REQUIRED>

  <!-- ****************************************************************** -->

  <!-- Info/NV: flexible name-value pairs: (n)ame; (t)ype; (v)alue -->
  <!ELEMENT Info (NV*)>
  <!ATTLIST Info
	    n CDATA #IMPLIED>
  <!ELEMENT NV EMPTY>
  <!ATTLIST NV
	    n CDATA #REQUIRED
	    t CDATA #IMPLIED
	    v CDATA #REQUIRED>

  <!-- ****************************************************************** -->
  <!-- Header								  -->
  <!-- ****************************************************************** -->
  <!ELEMENT Header (Info*)>
  <!ATTLIST Header
	    n CDATA #REQUIRED>

  <!-- ****************************************************************** -->
  <!-- Section Header							  -->
  <!-- ****************************************************************** -->
  <!ELEMENT SecHeader (MetricTable?, MetricDBTable?, TraceDBTable?, LoadModuleTable?, FileTable?, ProcedureTable?, Info*)>

    <!-- MetricTable: -->
    <!ELEMENT MetricTable (Metric)*>

    <!-- Metric: (i)d; (n)ame -->
    <!--   (v)alue-type: transient type of values -->
    <!--   (t)ype: persistent type of metric -->
    <!--   fmt: format; show; -->
    <!ELEMENT Metric (MetricFormula*, Info?)>
    <!ATTLIST Metric
	      i            CDATA #REQUIRED
	      n            CDATA #REQUIRED
	      v            (raw|final|derived-incr|derived) "raw"
	      t            (inclusive|exclusive|nil) "nil"
	      partner      CDATA #IMPLIED
	      fmt          CDATA #IMPLIED
	      show         (1|0) "1"
	      show-percent (1|0) "1">

    <!-- MetricFormula represents derived metrics: (t)ype; (frm): formula -->
    <!ELEMENT MetricFormula (Info?)>
    <!ATTLIST MetricFormula
	      t   (combine|finalize) "finalize"
	      i   CDATA #IMPLIED
	      frm CDATA #REQUIRED>

    <!-- Metric data, used in sections: (n)ame [from Metric]; (v)alue -->
    <!ELEMENT M EMPTY>
    <!ATTLIST M
	      n CDATA #REQUIRED
	      v CDATA #REQUIRED>

    <!-- MetricDBTable: -->
    <!ELEMENT MetricDBTable (MetricDB)*>

    <!-- MetricDB: (i)d; (n)ame -->
    <!--   db-glob:        file glob describing files in metric db -->
    <!--   db-id:          id within metric db -->
    <!--   db-num-metrics: number of metrics in db -->
    <!--   db-header-sz:   size (in bytes) of a db file header -->
    <!ELEMENT MetricDB EMPTY>
    <!ATTLIST MetricDB
	      i              CDATA #REQUIRED
	      n              CDATA #REQUIRED
	      db-glob        CDATA #IMPLIED
	      db-id          CDATA #IMPLIED
	      db-num-metrics CDATA #IMPLIED
	      db-header-sz   CDATA #IMPLIED>

    <!-- TraceDBTable: -->
    <!ELEMENT TraceDBTable (TraceDB)>

    <!-- TraceDB: (i)d -->
    <!--   db-min-time: min beginning time stamp (global) -->
    <!--   db-max-time: max ending time stamp (global) -->
    <!ELEMENT TraceDB EMPTY>
    <!ATTLIST TraceDB
	      i            CDATA #REQUIRED
	      db-glob      CDATA #IMPLIED
	      db-min-time  CDATA #IMPLIED
	      db-max-time  CDATA #IMPLIED
	      db-header-sz CDATA #IMPLIED>

    <!-- LoadModuleTable assigns a short name to a load module -->
    <!ELEMENT LoadModuleTable (LoadModule)*>

    <!ELEMENT LoadModule (Info?)>
    <!ATTLIST LoadModule
	      i CDATA #REQUIRED
	      n CDATA #REQUIRED>

    <!-- FileTable assigns a short name to a file -->
    <!ELEMENT FileTable (File)*>

    <!ELEMENT File (Info?)>
    <!ATTLIST File
	      i CDATA #REQUIRED
	      n CDATA #REQUIRED>

    <!-- ProcedureTable assigns a short name to a procedure -->
    <!ELEMENT ProcedureTable (Procedure)*>

    <!ELEMENT Procedure (Info?)>
    <!ATTLIST Procedure
	      i CDATA #REQUIRED
	      n CDATA #REQUIRED>

  <!-- ****************************************************************** -->
  <!-- Section: Call path profile					  -->
  <!-- ****************************************************************** -->
  <!ELEMENT SecCallPathProfile (SecHeader, SecCallPathProfileData)>
  <!ATTLIST SecCallPathProfile
	    i CDATA #REQUIRED
	    n CDATA #REQUIRED>

    <!ELEMENT SecCallPathProfileData (PF|M)*>
      <!-- Procedure frame -->
      <!--   (i)d: unique identifier for cross referencing -->
      <!--   (s)tatic scope id -->
      <!--   (n)ame: a string or an id in ProcedureTable -->
      <!--   (lm) load module: a string or an id in LoadModuleTable -->
      <!--   (f)ile name: a string or an id in LoadModuleTable -->
      <!--   (l)ine range: "beg-end" (inclusive range) -->
      <!--   (a)lien: whether frame is alien to enclosing P -->
      <!--   (v)ma-range-set: "{[beg-end), [beg-end)...}" -->
      <!ELEMENT PF (PF|Pr|L|C|S|M)*>
      <!ATTLIST PF
		i  CDATA #IMPLIED
		s  CDATA #IMPLIED
		n  CDATA #REQUIRED
		lm CDATA #IMPLIED
		f  CDATA #IMPLIED
		l  CDATA #IMPLIED
		v  CDATA #IMPLIED>
      <!-- Procedure (static): GOAL: replace with 'P' -->
      <!ELEMENT Pr (Pr|L|C|S|M)*>
      <!ATTLIST Pr
                i  CDATA #IMPLIED
		s  CDATA #IMPLIED
                n  CDATA #REQUIRED
		lm CDATA #IMPLIED
		f  CDATA #IMPLIED
                l  CDATA #IMPLIED
		a  (1|0) "0"
		v  CDATA #IMPLIED>
      <!-- Callsite (a special StatementRange) -->
      <!ELEMENT C (PF|M)*>
      <!ATTLIST C
		i CDATA #IMPLIED
		s CDATA #IMPLIED
		l CDATA #IMPLIED
		v CDATA #IMPLIED>

  <!-- ****************************************************************** -->
  <!-- Section: Flat profile						  -->
  <!-- ****************************************************************** -->
  <!ELEMENT SecFlatProfile (SecHeader, SecFlatProfileData)>
  <!ATTLIST SecFlatProfile
	    i CDATA #REQUIRED
	    n CDATA #REQUIRED>

    <!ELEMENT SecFlatProfileData (LM|M)*>
      <!-- Load module: (i)d; (n)ame; (v)ma-range-set -->
      <!ELEMENT LM (F|P|M)*>
      <!ATTLIST LM
                i CDATA #IMPLIED
                n CDATA #REQUIRED
		v CDATA #IMPLIED>
      <!-- File -->
      <!ELEMENT F (P|L|S|M)*>
      <!ATTLIST F
                i CDATA #IMPLIED
                n CDATA #REQUIRED>
      <!-- Procedure (Note 1) -->
      <!ELEMENT P (P|A|L|S|C|M)*>
      <!ATTLIST P
                i CDATA #IMPLIED
                n CDATA #REQUIRED
                l CDATA #IMPLIED
		v CDATA #IMPLIED>
      <!-- Alien (Note 1) -->
      <!ELEMENT A (A|L|S|C|M)*>
      <!ATTLIST A
                i CDATA #IMPLIED
                f CDATA #IMPLIED
                n CDATA #IMPLIED
                l CDATA #IMPLIED
		v CDATA #IMPLIED>
      <!-- Loop (Note 1,2) -->
      <!ELEMENT L (A|Pr|L|S|C|M)*>
      <!ATTLIST L
		i CDATA #IMPLIED
		s CDATA #IMPLIED
		l CDATA #IMPLIED
	        f CDATA #IMPLIED
		v CDATA #IMPLIED>
      <!-- Statement (Note 2) -->
      <!--   (it): trace record identifier -->
      <!ELEMENT S (S|M)*>
      <!ATTLIST S
		i  CDATA #IMPLIED
		it CDATA #IMPLIED
		s  CDATA #IMPLIED
		l  CDATA #IMPLIED
		v  CDATA #IMPLIED>
      <!-- Note 1: Contained Cs may not contain PFs -->
      <!-- Note 2: The 's' attribute is not used for flat profiles -->
]>
<HPCToolkitExperiment version="2.0">
<Header n="MPI_ping_modified2">
  <Info/>
</Header>
<SecCallPathProfile i="0" n="MPI_ping_modified2">
<SecHeader>
  <MetricTable>
    <Metric i="0" n="REALTIME (usec).[0,0]" v="raw" t="nil" show="1" show-percent="1">
      <Info><NV n="units" v="events"/><NV n="period" v="1"/></Info>
    </Metric>
    <Metric i="1" n="REALTIME (usec).[0,1]" v="raw" t="nil" show="1" show-percent="1">
      <Info><NV n="units" v="events"/><NV n="period" v="1"/></Info>
    </Metric>
    <Metric i="2" n="REALTIME (usec).[1,0]" v="raw" t="nil" show="1" show-percent="1">
      <Info><NV n="units" v="events"/><NV n="period" v="1"/></Info>
    </Metric>
    <Metric i="3" n="REALTIME (usec).[1,1]" v="raw" t="nil" show="1" show-percent="1">
      <Info><NV n="units" v="events"/><NV n="period" v="1"/></Info>
    </Metric>
    <Metric i="4" n="REALTIME (usec).[1,2]" v="raw" t="nil" show="1" show-percent="1">
      <Info><NV n="units" v="events"/><NV n="period" v="1"/></Info>
    </Metric>
    <Metric i="5" n="REALTIME (usec).[1,3]" v="raw" t="nil" show="1" show-percent="1">
      <Info><NV n="units" v="events"/><NV n="period" v="1"/></Info>
    </Metric>
    <Metric i="6" n="REALTIME (usec).[1,4]" v="raw" t="nil" show="1" show-percent="1">
      <Info><NV n="units" v="events"/><NV n="period" v="1"/></Info>
    </Metric>
    <Metric i="7" n="REALTIME (usec).[1,5]" v="raw" t="nil" show="1" show-percent="1">
      <Info><NV n="units" v="events"/><NV n="period" v="1"/></Info>
    </Metric>
    <Metric i="8" n="REALTIME (usec).[1,6]" v="raw" t="nil" show="1" show-percent="1">
      <Info><NV n="units" v="events"/><NV n="period" v="1"/></Info>
    </Metric>
    <Metric i="9" n="REALTIME (usec).[1,7]" v="raw" t="nil" show="1" show-percent="1">
      <Info><NV n="units" v="events"/><NV n="period" v="1"/></Info>
    </Metric>
    <Metric i="10" n="REALTIME (usec).[1,8]" v="raw" t="nil" show="1" show-percent="1">
      <Info><NV n="units" v="events"/><NV n="period" v="1"/></Info>
    </Metric>
    <Metric i="11" n="REALTIME (usec).[1,9]" v="raw" t="nil" show="1" show-percent="1">
      <Info><NV n="units" v="events"/><NV n="period" v="1"/></Info>
    </Metric>
  </MetricTable>
  <MetricDBTable>
  </MetricDBTable>
  <TraceDBTable>
    <TraceDB i="0" db-glob="*.hpctrace" db-min-time="1475226827539437" db-max-time="1475226828666599" db-header-sz="32"/>
  </TraceDBTable>
  <LoadModuleTable>
    <LoadModule i="2" n="/global/u2/h/hashim/Github/HPC_Specialization/Intel_openMP_opt/custom_tests/bin/MPI_ping_modified2"/>
    <LoadModule i="139" n="/global/common/edison/software/hpctoolkit/4693/lib/hpctoolkit/ext-libs/libmonitor.so.0.0.0"/>
    <LoadModule i="150" n="/opt/intel/compilers_and_libraries_2016.0.109/linux/mpi/intel64/lib/release_mt/libmpi.so.12.0"/>
    <LoadModule i="399" n="/lib64/libpthread-2.11.3.so"/>
    <LoadModule i="431" n="/global/u2/h/hashim/Github/HPC_Specialization/Intel_openMP_opt/build/runtime/src/libomp.so"/>
    <LoadModule i="516" n="/lib64/libc-2.11.3.so"/>
    <LoadModule i="594" n="/lib64/ld-2.11.3.so"/>
  </LoadModuleTable>
  <FileTable>
    <File i="3" n="./src/global/u2/h/hashim/Github/HPC_Specialization/Intel_openMP_opt/custom_tests/bc/MPI_ping_modified2.bc"/>
    <File i="62" n="~unknown-file~"/>
    <File i="110" n=""/>
    <File i="112" n=""/>
    <File i="140" n="/global/common/edison/usg/hpctoolkit/build/hpctoolkit-externals/BUILD/libmonitor/work/src/../../libmonitor-0.x-r149/src/mpi_init_c.c"/>
    <File i="143" n="/global/common/edison/usg/hpctoolkit/build/hpctoolkit-externals/BUILD/libmonitor/work/src/../../libmonitor-0.x-r149/src/pthread.c"/>
    <File i="147" n="/global/common/edison/usg/hpctoolkit/build/hpctoolkit-externals/BUILD/libmonitor/work/src/../../libmonitor-0.x-r149/src/mpi_final_c.c"/>
    <File i="151" n="/tmp/mpi5.xtmpdir.7b663e0dc22b2304e487307e376dc132.39050_32e/mpi5.32e.ww29.20150715/dev/x86_64/release_mt/../../src/mpi/init/init.c"/>
    <File i="154" n="/tmp/mpi5.xtmpdir.7b663e0dc22b2304e487307e376dc132.39050_32e/mpi5.32e.ww29.20150715/dev/x86_64/release_mt/../../src/mpi/init/async.c"/>
    <File i="157" n="/tmp/mpi5.xtmpdir.7b663e0dc22b2304e487307e376dc132.39050_32e/mpi5.32e.ww29.20150715/dev/x86_64/release_mt/../../src/util/thread/mpiu_thread.c"/>
    <File i="160" n="/tmp/mpi5.xtmpdir.7b663e0dc22b2304e487307e376dc132.39050_32e/mpi5.32e.ww29.20150715/dev/x86_64/release_mt/../../src/mpi/pt2pt/irecv.c"/>
    <File i="163" n="/tmp/mpi5.xtmpdir.7b663e0dc22b2304e487307e376dc132.39050_32e/mpi5.32e.ww29.20150715/dev/x86_64/release_mt/../../src/include/mpiimplthreadpost.h"/>
    <File i="167" n="/tmp/mpi5.xtmpdir.7b663e0dc22b2304e487307e376dc132.39050_32e/mpi5.32e.ww29.20150715/dev/x86_64/release_mt/../../src/mpid/ch3/src/mpid_irecv.c"/>
    <File i="170" n="/tmp/mpi5.xtmpdir.7b663e0dc22b2304e487307e376dc132.39050_32e/mpi5.32e.ww29.20150715/dev/x86_64/release_mt/../../src/mpid/ch3/channels/nemesis/src/mpid_nem_lmt.c"/>
    <File i="173" n="/tmp/mpi5.xtmpdir.7b663e0dc22b2304e487307e376dc132.39050_32e/mpi5.32e.ww29.20150715/dev/x86_64/release_mt/../../src/mpid/ch3/channels/nemesis/src/mpid_nem_lmt_shm.c"/>
    <File i="178" n="/tmp/mpi5.xtmpdir.7b663e0dc22b2304e487307e376dc132.39050_32e/mpi5.32e.ww29.20150715/dev/x86_64/release_mt/../../src/mpid/ch3/channels/nemesis/include/mpid_nem_impi_extensions.h"/>
    <File i="181" n="/tmp/mpi5.xtmpdir.7b663e0dc22b2304e487307e376dc132.39050_32e/mpi5.32e.ww29.20150715/dev/x86_64/release_mt/../../src/mpi/pt2pt/waitall.c"/>
    <File i="187" n="/tmp/mpi5.xtmpdir.7b663e0dc22b2304e487307e376dc132.39050_32e/mpi5.32e.ww29.20150715/dev/x86_64/release_mt/../../src/mpid/ch3/channels/nemesis/src/ch3_progress.c"/>
    <File i="191" n="/tmp/mpi5.xtmpdir.7b663e0dc22b2304e487307e376dc132.39050_32e/mpi5.32e.ww29.20150715/dev/x86_64/release_mt/../../src/mpid/ch3/channels/nemesis/include/mpid_nem_inline.h"/>
    <File i="194" n="/tmp/mpi5.xtmpdir.7b663e0dc22b2304e487307e376dc132.39050_32e/mpi5.32e.ww29.20150715/dev/x86_64/release_mt/../../src/mpid/ch3/channels/nemesis/include/mpid_nem_fbox.h"/>
    <File i="205" n="/tmp/mpi5.xtmpdir.7b663e0dc22b2304e487307e376dc132.39050_32e/mpi5.32e.ww29.20150715/dev/x86_64/release_mt/../../src/mpi/pt2pt/mpir_request.c"/>
    <File i="208" n="/tmp/mpi5.xtmpdir.7b663e0dc22b2304e487307e376dc132.39050_32e/mpi5.32e.ww29.20150715/dev/x86_64/release_mt/../../src/mpid/ch3/src/ch3u_request.c"/>
    <File i="214" n="/tmp/mpi5.xtmpdir.7b663e0dc22b2304e487307e376dc132.39050_32e/mpi5.32e.ww29.20150715/dev/x86_64/release_mt/../../src/mpi/pt2pt/isend.c"/>
    <File i="219" n="/tmp/mpi5.xtmpdir.7b663e0dc22b2304e487307e376dc132.39050_32e/mpi5.32e.ww29.20150715/dev/x86_64/release_mt/../../src/mpid/ch3/src/mpid_isend.c"/>
    <File i="228" n="/tmp/mpi5.xtmpdir.7b663e0dc22b2304e487307e376dc132.39050_32e/mpi5.32e.ww29.20150715/dev/x86_64/release_mt/../../src/mpid/ch3/channels/nemesis/src/ch3_istartmsgv.c"/>
    <File i="235" n="/tmp/mpi5.xtmpdir.7b663e0dc22b2304e487307e376dc132.39050_32e/mpi5.32e.ww29.20150715/dev/x86_64/release_mt/../../src/mpi/pt2pt/wait.c"/>
    <File i="246" n="/tmp/mpi5.xtmpdir.7b663e0dc22b2304e487307e376dc132.39050_32e/mpi5.32e.ww29.20150715/dev/x86_64/release_mt/../../src/mpi/init/finalize.c"/>
    <File i="253" n="/tmp/mpi5.xtmpdir.7b663e0dc22b2304e487307e376dc132.39050_32e/mpi5.32e.ww29.20150715/dev/x86_64/release_mt/../../src/mpid/ch3/src/mpid_finalize.c"/>
    <File i="256" n="/tmp/mpi5.xtmpdir.7b663e0dc22b2304e487307e376dc132.39050_32e/mpi5.32e.ww29.20150715/dev/x86_64/release_mt/../../src/mpi/coll/barrier.c"/>
    <File i="265" n="/tmp/mpi5.xtmpdir.7b663e0dc22b2304e487307e376dc132.39050_32e/mpi5.32e.ww29.20150715/dev/x86_64/release_mt/../../src/mpi/coll/helper_fns.c"/>
    <File i="272" n="/tmp/mpi5.xtmpdir.7b663e0dc22b2304e487307e376dc132.39050_32e/mpi5.32e.ww29.20150715/dev/x86_64/release_mt/../../src/mpid/ch3/src/mpidi_pg.c"/>
    <File i="275" n="/tmp/mpi5.xtmpdir.7b663e0dc22b2304e487307e376dc132.39050_32e/mpi5.32e.ww29.20150715/dev/x86_64/release_mt/../../src/pmi/simple/simple_pmi.c"/>
    <File i="278" n="/tmp/mpi5.xtmpdir.7b663e0dc22b2304e487307e376dc132.39050_32e/mpi5.32e.ww29.20150715/dev/x86_64/release_mt/../../src/pmi/simple/simple_pmiutil.c"/>
    <File i="293" n="/tmp/mpi5.xtmpdir.7b663e0dc22b2304e487307e376dc132.39050_32e/mpi5.32e.ww29.20150715/dev/src/openpa/src/primitives/opa_gcc_intel_32_64_ops.h"/>
    <File i="335" n="/tmp/mpi5.xtmpdir.7b663e0dc22b2304e487307e376dc132.39050_32e/mpi5.32e.ww29.20150715/dev/x86_64/release_mt/../../src/mpid/common/sched/mpid_sched.c"/>
    <File i="345" n="~unknown-file~"/>
    <File i="357" n="/tmp/mpi5.xtmpdir.7b663e0dc22b2304e487307e376dc132.39050_32e/mpi5.32e.ww29.20150715/dev/x86_64/release_mt/../../src/mpid/ch3/channels/nemesis/src/mpid_nem_impi_extensions.c"/>
    <File i="362" n="/tmp/mpi5.xtmpdir.7b663e0dc22b2304e487307e376dc132.39050_32e/mpi5.32e.ww29.20150715/dev/x86_64/release_mt/../../src/mpid/common/datatype/mpid_segment.c"/>
    <File i="365" n="/tmp/mpi5.xtmpdir.7b663e0dc22b2304e487307e376dc132.39050_32e/mpi5.32e.ww29.20150715/dev/x86_64/release_mt/../../src/mpid/common/datatype/dataloop/segment.c"/>
    <File i="378" n="/tmp/mpi5.xtmpdir.7b663e0dc22b2304e487307e376dc132.39050_32e/mpi5.32e.ww29.20150715/dev/src/I_MPI/rtc/x86_64/release_mt/../../i_rtc_hook.c"/>
    <File i="400" n="~unknown-file~"/>
    <File i="432" n="~unknown-file~"/>
    <File i="437" n="./src/global/u2/h/hashim/Github/HPC_Specialization/Intel_openMP_opt/runtime/src/kmp_runtime.c"/>
    <File i="444" n="./src/global/u2/h/hashim/Github/HPC_Specialization/Intel_openMP_opt/runtime/src/kmp_settings.c"/>
    <File i="453" n="./src/global/u2/h/hashim/Github/HPC_Specialization/Intel_openMP_opt/runtime/src/kmp_affinity.cpp"/>
    <File i="478" n="./src/global/u2/h/hashim/Github/HPC_Specialization/Intel_openMP_opt/runtime/src/kmp_barrier.cpp"/>
    <File i="499" n="./src/global/u2/h/hashim/Github/HPC_Specialization/Intel_openMP_opt/runtime/src/z_Linux_util.c"/>
    <File i="517" n="~unknown-file~"/>
    <File i="595" n="~unknown-file~"/>
  </FileTable>
  <ProcedureTable>
    <Procedure i="6" n=".omp_outlined."/>
    <Procedure i="106" n="main"/>
    <Procedure i="130" n="placeHolder"/>
    <Procedure i="141" n="MPI_Init"/>
    <Procedure i="144" n="pthread_create"/>
    <Procedure i="148" n="MPI_Finalize"/>
    <Procedure i="152" n="PMPI_Init"/>
    <Procedure i="283" n="progress_fn"/>
    <Procedure i="155" n="MPIR_Init_async_thread"/>
    <Procedure i="249" n="MPIR_Finalize_async_thread"/>
    <Procedure i="158" n="MPIU_Thread_create"/>
    <Procedure i="281" n="MPEI_Thread_start"/>
    <Procedure i="161" n="PMPI_Irecv"/>
    <Procedure i="164" n="MPIU_Thread_CS_enter_lockname_recursive_impl_"/>
    <Procedure i="212" n="MPIU_Thread_CS_exit_lockname_recursive_impl_"/>
    <Procedure i="329" n="MPIU_Thread_CS_yield_lockname_recursive_impl_"/>
    <Procedure i="168" n="MPID_Irecv"/>
    <Procedure i="224" n="MPID_nem_lmt_RndvSend"/>
    <Procedure i="353" n="pkt_CTS_handler"/>
    <Procedure i="171" n="do_cts"/>
    <Procedure i="226" n="MPID_nem_lmt_shm_initiate_lmt"/>
    <Procedure i="388" n="MPID_nem_lmt_shm_start_recv"/>
    <Procedure i="355" n="MPID_nem_lmt_shm_start_send"/>
    <Procedure i="317" n="lmt_shm_send_progress"/>
    <Procedure i="176" n="lmt_shm_recv_progress"/>
    <Procedure i="174" n="lmt_shm_progress_vc"/>
    <Procedure i="179" n="impi_memcpy_cloop"/>
    <Procedure i="185" n="MPIR_Waitall_impl"/>
    <Procedure i="182" n="PMPI_Waitall"/>
    <Procedure i="188" n="PMPIDI_CH3I_Progress"/>
    <Procedure i="200" n="MPIDI_CH3I_Progress_delay"/>
    <Procedure i="343" n="MPIDI_CH3I_Progress_continue"/>
    <Procedure i="384" n="MPID_nem_handle_pkt"/>
    <Procedure i="231" n="MPID_nem_mpich_sendv_header"/>
    <Procedure i="302" n="MPID_nem_recv_seqno_matches"/>
    <Procedure i="192" n="MPID_nem_mpich_test_recv"/>
    <Procedure i="296" n="poll_active_fboxes"/>
    <Procedure i="195" n="poll_all_fboxes"/>
    <Procedure i="206" n="MPIR_Request_complete"/>
    <Procedure i="209" n="MPIDI_CH3_Request_destroy"/>
    <Procedure i="360" n="MPIDI_CH3U_Request_load_send_iov"/>
    <Procedure i="215" n="PMPI_Isend"/>
    <Procedure i="220" n="MPID_Isend"/>
    <Procedure i="229" n="MPIDI_CH3_iStartMsgv"/>
    <Procedure i="241" n="MPIR_Wait_impl"/>
    <Procedure i="236" n="PMPI_Wait"/>
    <Procedure i="247" n="PMPI_Finalize"/>
    <Procedure i="254" n="MPID_Finalize"/>
    <Procedure i="263" n="MPIR_Barrier_intra"/>
    <Procedure i="259" n="MPIR_Barrier"/>
    <Procedure i="257" n="MPIR_Barrier_impl"/>
    <Procedure i="261" n="I_MPIR_Barrier_intra"/>
    <Procedure i="268" n="MPIC_Wait"/>
    <Procedure i="266" n="MPIC_Sendrecv"/>
    <Procedure i="273" n="MPIDI_PG_Finalize"/>
    <Procedure i="276" n="GetResponse"/>
    <Procedure i="279" n="PMIU_readline"/>
    <Procedure i="294" n="OPA_load_int"/>
    <Procedure i="300" n="OPA_load_ptr"/>
    <Procedure i="308" n="OPA_load_acquire_int"/>
    <Procedure i="348" n="MPIDU_Sched_are_pending"/>
    <Procedure i="339" n="MPIDU_Sched_progress_state"/>
    <Procedure i="336" n="MPIDU_Sched_progress"/>
    <Procedure i="346" n="~unknown-proc~"/>
    <Procedure i="358" n="MPID_nem_impi_load_send_iov"/>
    <Procedure i="395" n="PI_MPI_PW_Sched_yield"/>
    <Procedure i="363" n="MPID_Segment_pack_vector"/>
    <Procedure i="366" n="MPID_Segment_manipulate"/>
    <Procedure i="379" n="free"/>
    <Procedure i="401" n="_L_lock_1008"/>
    <Procedure i="403" n="__lll_lock_wait"/>
    <Procedure i="405" n="pthread_cond_wait@@GLIBC_2.3.2"/>
    <Procedure i="407" n="_L_unlock_553"/>
    <Procedure i="409" n="__lll_unlock_wake"/>
    <Procedure i="411" n="__pthread_mutex_cond_lock"/>
    <Procedure i="413" n="_L_cond_lock_1080"/>
    <Procedure i="415" n="__pthread_mutex_lock"/>
    <Procedure i="417" n="pthread_create@@GLIBC_2.2.5"/>
    <Procedure i="419" n="do_clone"/>
    <Procedure i="421" n="__read_nocancel"/>
    <Procedure i="423" n="__pthread_mutex_unlock_usercnt"/>
    <Procedure i="425" n="pthread_mutex_unlock"/>
    <Procedure i="427" n="pthread_cond_broadcast@@GLIBC_2.3.2"/>
    <Procedure i="429" n="pthread_cond_timedwait@@GLIBC_2.3.2"/>
    <Procedure i="433" n="__kmpc_fork_call_start"/>
    <Procedure i="435" n="__kmp_get_global_thread_id_reg"/>
    <Procedure i="440" n="__kmp_runtime_initialize"/>
    <Procedure i="442" n="__kmp_env_initialize(char const*)"/>
    <Procedure i="447" n="__kmp_fork_call2"/>
    <Procedure i="449" n="__kmp_parallel_initialize"/>
    <Procedure i="458" n="__kmp_affinity_bind_thread"/>
    <Procedure i="460" n="__kmp_set_system_affinity"/>
    <Procedure i="462" n="__kmp_allocate_team"/>
    <Procedure i="464" n="__kmp_allocate_thread"/>
    <Procedure i="466" n="__kmp_create_monitor"/>
    <Procedure i="468" n="__kmp_create_worker"/>
    <Procedure i="472" n="__kmpc_fork_call_end"/>
    <Procedure i="474" n="__kmp_fork_barrier"/>
    <Procedure i="476" n="__kmp_task_team_setup"/>
    <Procedure i="481" n="__kmp_invoke_task_func"/>
    <Procedure i="483" n="__kmp_invoke_microtask"/>
    <Procedure i="485" n="__kmpc_reduce_nowait"/>
    <Procedure i="487" n="__kmp_barrier"/>
    <Procedure i="491" n="kmp_flag_64::wait(kmp_info*, int, void*)"/>
    <Procedure i="493" n="__kmp_yield"/>
    <Procedure i="495" n="__kmp_join_call"/>
    <Procedure i="497" n="__kmp_join_barrier(int)"/>
    <Procedure i="502" n="__kmp_launch_thread"/>
    <Procedure i="504" n="__kmp_suspend_64"/>
    <Procedure i="506" n="__kmp_init_implicit_task"/>
    <Procedure i="508" n="__kmp_store_x87_fpu_control_word"/>
    <Procedure i="510" n="__kmpc_for_static_fini"/>
    <Procedure i="512" n="__kmp_determine_reduction_method"/>
    <Procedure i="438" n="__kmp_do_serial_initialize()"/>
    <Procedure i="451" n="__kmp_do_middle_initialize()"/>
    <Procedure i="470" n="__kmp_alloc_argv_entries(int, kmp_team*, int)"/>
    <Procedure i="445" n="__kmp_stg_init()"/>
    <Procedure i="454" n="__kmp_aux_affinity_initialize()"/>
    <Procedure i="456" n="__kmp_affinity_create_x2apicid_map(AddrUnsPair**, kmp_i18n_id*)"/>
    <Procedure i="479" n="__kmp_hyper_barrier_release(barrier_type, kmp_info*, int, int, int, void*)"/>
    <Procedure i="489" n="__kmp_hyper_barrier_gather(barrier_type, kmp_info*, int, int, void (*)(void*, void*), void*)"/>
    <Procedure i="500" n="__kmp_launch_worker(void*)"/>
    <Procedure i="514" n="__kmp_launch_monitor(void*)"/>
    <Procedure i="518" n="printf"/>
    <Procedure i="520" n="_IO_vfprintf"/>
    <Procedure i="522" n="buffered_vfprintf"/>
    <Procedure i="524" n="_IO_default_xsputn"/>
    <Procedure i="526" n="_IO_file_xsputn@@GLIBC_2.2.5"/>
    <Procedure i="528" n="new_do_write"/>
    <Procedure i="530" n="_IO_file_write@@GLIBC_2.2.5"/>
    <Procedure i="532" n="__write_nocancel"/>
    <Procedure i="534" n="free"/>
    <Procedure i="536" n="puts"/>
    <Procedure i="538" n="__GI_strlen"/>
    <Procedure i="540" n="_IO_file_overflow@@GLIBC_2.2.5"/>
    <Procedure i="542" n="_IO_do_write@@GLIBC_2.2.5"/>
    <Procedure i="544" n="__sysconf"/>
    <Procedure i="546" n="get_nprocs"/>
    <Procedure i="548" n="next_line"/>
    <Procedure i="550" n="__read_nocancel"/>
    <Procedure i="552" n="qsort_r"/>
    <Procedure i="554" n="phys_pages_info"/>
    <Procedure i="556" n="fgets_unlocked"/>
    <Procedure i="558" n="_IO_getline_info"/>
    <Procedure i="560" n="_IO_default_uflow"/>
    <Procedure i="562" n="_IO_file_underflow@@GLIBC_2.2.5"/>
    <Procedure i="564" n="_IO_file_read"/>
    <Procedure i="566" n="__strcmp_sse42"/>
    <Procedure i="568" n="syscall"/>
    <Procedure i="570" n="clone"/>
    <Procedure i="572" n="_L_unlock_12927"/>
    <Procedure i="574" n="__lll_unlock_wake_private"/>
    <Procedure i="576" n="_L_lock_12789"/>
    <Procedure i="578" n="__lll_lock_wait_private"/>
    <Procedure i="580" n="sched_yield"/>
    <Procedure i="582" n="_L_lock_42"/>
    <Procedure i="584" n="_L_unlock_105"/>
    <Procedure i="586" n="__libc_malloc"/>
    <Procedure i="588" n="__mempcpy"/>
    <Procedure i="590" n="__libc_enable_asynccancel"/>
    <Procedure i="592" n="strchrnul"/>
    <Procedure i="596" n="__tls_get_addr"/>
    <Procedure i="598" n="_dl_runtime_resolve"/>
    <Procedure i="600" n="_dl_fixup"/>
    <Procedure i="602" n="_dl_lookup_symbol_x"/>
    <Procedure i="604" n="do_lookup_x"/>
  </ProcedureTable>
  <Info/>
</SecHeader>
<SecCallPathProfileData>
<PF i="2" s="106" l="0" lm="2" f="62" n="106">
<C i="3" s="107" l="0">
<PF i="4" s="141" l="33" lm="139" f="140" n="141">
<C i="5" s="142" l="33">
<PF i="6" s="152" l="244" lm="150" f="151" n="152">
<C i="7" s="153" l="244">
<PF i="8" s="155" l="101" lm="150" f="154" n="155">
<C i="9" s="156" l="101">
<PF i="10" s="158" l="70" lm="150" f="157" n="158">
<C i="11" s="159" l="70">
<PF i="12" s="144" l="1061" lm="139" f="143" n="144">
<S i="13" s="145" l="1061"/>
</PF>
</C>
</PF>
</C>
</PF>
</C>
</PF>
</C>
</PF>
</C>
<L i="14" s="110" l="0" f="110">
<C i="15" s="111" l="0">
<PF i="16" s="518" l="0" lm="516" f="517" n="518">
<C i="17" s="519" l="0">
<PF i="18" s="520" l="0" lm="516" f="517" n="520">
<C i="19" s="521" l="0">
<PF i="20" s="522" l="0" lm="516" f="517" n="522">
<C i="21" s="523" l="0">
<PF i="22" s="520" l="0" lm="516" f="517" n="520">
<C i="23" s="521" l="0">
<PF i="24" s="524" l="0" lm="516" f="517" n="524">
<S i="25" s="525" l="0" it="403">
<M n="0" v="1006"/>
</S>
</PF>
</C>
</PF>
</C>
<C i="26" s="523" l="0">
<PF i="27" s="526" l="0" lm="516" f="517" n="526">
<C i="28" s="527" l="0">
<PF i="29" s="528" l="0" lm="516" f="517" n="528">
<C i="30" s="529" l="0">
<PF i="31" s="530" l="0" lm="516" f="517" n="530">
<C i="32" s="531" l="0">
<PF i="33" s="532" l="0" lm="516" f="517" n="532">
<S i="34" s="533" l="0" it="101">
<M n="0" v="8078"/>
</S>
</PF>
</C>
</PF>
</C>
</PF>
</C>
</PF>
</C>
</PF>
</C>
</PF>
</C>
</PF>
</C>
<L i="35" s="112" l="0" f="112">
<C i="36" s="115" l="0">
<PF i="37" s="161" l="77" lm="150" f="160" n="161">
<C i="38" s="162" l="77">
<PF i="39" s="164" l="102" lm="150" f="163" n="164">
<C i="40" s="165" l="104">
<PF i="41" s="401" l="0" lm="399" f="400" n="401">
<C i="42" s="402" l="0">
<PF i="43" s="403" l="0" lm="399" f="400" n="403">
<S i="44" s="404" l="0" it="383">
<M n="0" v="2027"/>
</S>
</PF>
</C>
</PF>
</C>
</PF>
</C>
<C i="45" s="166" l="136">
<PF i="46" s="168" l="126" lm="150" f="167" n="168">
<C i="47" s="169" l="126">
<PF i="48" s="171" l="612" lm="150" f="170" n="171">
<C i="49" s="172" l="612">
<PF i="50" s="174" l="1117" lm="150" f="173" n="174">
<C i="51" s="175" l="1117">
<PF i="52" s="176" l="804" lm="150" f="173" n="176">
<S i="53" s="177" l="804" it="343"/>
</PF>
<PF i="54" s="179" l="623" lm="150" f="178" n="179">
<S i="55" s="180" l="624">
<M n="0" v="11101"/>
</S>
</PF>
</C>
</PF>
</C>
</PF>
</C>
</PF>
</C>
</PF>
</C>
</L>
<C i="56" s="117" l="0">
<PF i="57" s="182" l="275" lm="150" f="181" n="182">
<C i="58" s="183" l="275">
<PF i="59" s="164" l="102" lm="150" f="163" n="164">
<C i="60" s="165" l="104">
<PF i="61" s="401" l="0" lm="399" f="400" n="401">
<C i="62" s="402" l="0">
<PF i="63" s="403" l="0" lm="399" f="400" n="403">
<S i="64" s="404" l="0" it="241">
<M n="0" v="7229"/>
</S>
</PF>
</C>
</PF>
</C>
</PF>
</C>
<C i="65" s="184" l="307">
<PF i="66" s="185" l="161" lm="150" f="181" n="185">
<C i="67" s="186" l="161">
<PF i="68" s="188" l="374" lm="150" f="187" n="188">
<S i="69" s="189" l="374" it="389"/>
<C i="70" s="190" l="459">
<PF i="71" s="192" l="911" lm="150" f="191" n="192">
<S i="72" s="193" l="911" it="49"/>
</PF>
<PF i="73" s="195" l="94" lm="150" f="194" n="195">
<S i="74" s="196" l="103">
<M n="0" v="1018"/>
</S>
</PF>
</C>
<C i="75" s="197" l="752">
<PF i="76" s="174" l="1117" lm="150" f="173" n="174">
<C i="77" s="175" l="1117">
<PF i="78" s="176" l="804" lm="150" f="173" n="176">
<S i="79" s="177" l="804" it="71"/>
<S i="80" s="198" l="885">
<M n="0" v="1003"/>
</S>
</PF>
<PF i="81" s="179" l="623" lm="150" f="178" n="179">
<S i="82" s="180" l="624">
<M n="0" v="3019"/>
</S>
</PF>
</C>
</PF>
</C>
<S i="83" s="199" l="419">
<M n="0" v="1002"/>
</S>
</PF>
<PF i="84" s="200" l="1249" lm="150" f="187" n="200">
<S i="85" s="201" l="1249">
<M n="0" v="1004"/>
</S>
<S i="86" s="202" l="1261">
<M n="0" v="1003"/>
</S>
<C i="87" s="203" l="1264">
<PF i="88" s="405" l="0" lm="399" f="400" n="405">
<C i="89" s="406" l="0">
<PF i="90" s="407" l="0" lm="399" f="400" n="407">
<C i="91" s="408" l="0">
<PF i="92" s="409" l="0" lm="399" f="400" n="409">
<S i="93" s="410" l="0" it="285">
<M n="0" v="2011"/>
</S>
</PF>
</C>
</PF>
</C>
<C i="94" s="406" l="0">